{
  "$schema": "./codex-harness-execution-profiles.v0.2.schema.json",
  "schema_version": "codex-harness.execution-profiles.v0.2",
  "profiles": [
    {"id": "parent-sol-high", "role": "parent", "model": "gpt-5.6-sol", "reasoning_effort": "high"},
    {"id": "parent-terra-xhigh", "role": "parent", "model": "gpt-5.6-terra", "reasoning_effort": "xhigh"},
    {"id": "worker-full-terra-high", "role": "worker", "model": "gpt-5.6-terra", "reasoning_effort": "high"},
    {"id": "worker-lite-luna-max", "role": "worker", "model": "gpt-5.6-luna", "reasoning_effort": "max"},
    {"id": "worker-lite-terra-high", "role": "worker", "model": "gpt-5.6-terra", "reasoning_effort": "high"},
    {"id": "verifier-sol-high", "role": "verifier", "model": "gpt-5.6-sol", "reasoning_effort": "high"}
  ],
  "worker_bindings": {"full": ["worker-full-terra-high"], "lite": ["worker-lite-luna-max", "worker-lite-terra-high"]},
  "verifier_bindings": {"full": ["verifier-sol-high"]}
}
